{
 "schemaVersion": "pog.ai.report/0.2-candidate",
 "stage": 0,
 "projectId": "0x1111111111111111111111111111111111111111111111111111111111111111",
 "procurementId": "0x2222222222222222222222222222222222222222222222222222222222222222",
 "evidenceVersion": "10",
 "evidenceHash": "0xa0df269bf16024f5148da541bf4fded63cfe16ac3a43b6b1f2f0eed0716e0527",
 "executionMode": "synthetic_fixture",
 "versions": {
  "serviceVersion": "synthetic-service-v1",
  "ruleSetVersion": "candidate-rules-v1",
  "scorePolicyVersion": "serialization-test-score-v1",
  "modelProvider": null,
  "modelId": null,
  "modelVersion": null,
  "promptVersion": null,
  "extractionSchemaVersion": "candidate-extraction-v1"
 },
 "outcome": 1,
 "riskScoreBps": 1000,
 "completeness": "complete",
 "summary": "\u4e2d\u6587\ud83d\ude00 NFC:\u00e9 NFD:e\u0301 line:\u2028paragraph:\u2029 quote:\" slash:/ backslash:\\ html:<>& controls:\u0000\u0001\u0002\u0003\u0004\u0005\u0006\u0007\b\t\n\u000b\f\r\u000e\u000f\u0010\u0011\u0012\u0013\u0014\u0015\u0016\u0017\u0018\u0019\u001a\u001b\u001c\u001d\u001e\u001f",
 "evidenceRefs": [
  {
   "evidenceId": "goods-request-001",
   "kind": "Photo",
   "version": "1",
   "contentSha256": "0xbe060cdf23e3ac633fc0b515c9a1f7dddb6f1b463d38426ef4a217d3934e4283",
   "leafKeccak256": "0x3e88704fdd2e153ec5c690688d1d977341c0708a9e0a428bb35c59f18c27a20c",
   "pages": null
  },
  {
   "evidenceId": "po-001",
   "kind": "PO",
   "version": "1",
   "contentSha256": "0xb65425d4f7e603bfee5d5ab2887d7fbbe70877058120b5fd8b421b40824d9706",
   "leafKeccak256": "0x6a9aa88f94db59e6903a5817ae72511750b1255867958b71254b97be91d6d9d5",
   "pages": [
    1
   ]
  },
  {
   "evidenceId": "quote-001",
   "kind": "Quote",
   "version": "1",
   "contentSha256": "0x21af942e06dc701f958b7a6fc5c1d5ea721bfd64f69668d57e730027a16fb806",
   "leafKeccak256": "0x6844f12ae8bc4e466016b2e2b9c8dcd7ba67e34c2a15d7d980f7115b52b1eb78",
   "pages": [
    1
   ]
  },
  {
   "evidenceId": "request-001",
   "kind": "ProcurementRequest",
   "version": "1",
   "contentSha256": "0x5894c22f1f03bb37734858a824aa96e39e37ee9bd063b0371d55c7faa1ece829",
   "leafKeccak256": "0x5044d916fe931336514b0d3d3901a8570fd1a3ff6c822ae5b3bded4832166e4f",
   "pages": [
    1
   ]
  }
 ],
 "findings": [
  {
   "findingId": "f001",
   "reasonCode": "SERIALIZATION_TEST",
   "severity": "information",
   "message": "Non-paged evidence test",
   "evidenceLocators": [
    {
     "evidenceId": "goods-request-001",
     "page": null,
     "field": null
    }
   ]
  }
 ],
 "missingInputs": [],
 "inputHash": "0x31a3857a3ffef45a0f5a5c5a8126932c0f89a92355c660ec2c1ad956117f1584"
}
